Enter password: ****
Welcome to the MySQL monitor.  Commands end with ; or \g.
Your MySQL connection id is 3
Server version: 5.7.25-log MySQL Community Server (GPL)

Copyright (c) 2000, 2019, Oracle and/or its affiliates. All rights reserved.

Oracle is a registered trademark of Oracle Corporation and/or its
affiliates. Other names may be trademarks of their respective
owners.

Type 'help;' or '\h' for help. Type '\c' to clear the current input statement.

mysql> show databases;
+--------------------+
| Database           |
+--------------------+
| information_schema |
| mysql              |
| performance_schema |
| sys                |
| test               |
+--------------------+
5 rows in set (0.00 sec)

mysql> use test;
Database changed
mysql> show tables;
+----------------+
| Tables_in_test |
+----------------+
| student        |
+----------------+
1 row in set (0.00 sec)

mysql> select * from student;
+------+-----------+------+
| sid  | sname     | ssex |
+------+-----------+------+
|    1 | Ö£ÖÐÍØ    | ÄÐ   |
|    2 | Ö£ÖÐÍØ    | ÄÐ   |
|    3 | Ö£ÖÐÍØ    | ÄÐ   |
+------+-----------+------+
3 rows in set (0.00 sec)

mysql> update student set sname = 'zhengzhongtuo',ssex = 'Å®';
ERROR 1406 (22001): Data too long for column 'sname' at row 1
mysql> update student set sname = 'Ö£ÖÐÍØ';
Query OK, 0 rows affected (0.01 sec)
Rows matched: 3  Changed: 0  Warnings: 0

mysql> select * from student;
+------+-----------+------+
| sid  | sname     | ssex |
+------+-----------+------+
|    1 | Ö£ÖÐÍØ    | ÄÐ   |
|    2 | Ö£ÖÐÍØ    | ÄÐ   |
|    3 | Ö£ÖÐÍØ    | ÄÐ   |
+------+-----------+------+
3 rows in set (0.00 sec)

mysql> update student set ssex = 'Å®';
Query OK, 3 rows affected (0.00 sec)
Rows matched: 3  Changed: 3  Warnings: 0

mysql> select * from student;
+------+-----------+------+
| sid  | sname     | ssex |
+------+-----------+------+
|    1 | Ö£ÖÐÍØ    | Å®   |
|    2 | Ö£ÖÐÍØ    | Å®   |
|    3 | Ö£ÖÐÍØ    | Å®   |
+------+-----------+------+
3 rows in set (0.00 sec)

mysql> drop table student;
Query OK, 0 rows affected (0.02 sec)

mysql> show tables;
Empty set (0.00 sec)

mysql> create table student(
    ->   sid int(15),
    ->   sname varchar(10),
    ->   ssex varchar(4),
    ->   sage int(3),
    ->   sbirthday date,
    ->   chinese float(5,2),
    ->   english float(5,2),
    ->   physics float(5,2),
    ->   physical float(5,2),
    ->   classid int(4)
    -> );
Query OK, 0 rows affected (0.02 sec)

mysql> insert into student values(1,'zhangsan','nan',18,'2000-01-01',98,95,89,92,1);
Query OK, 1 row affected (0.00 sec)

mysql> select * from student;
+------+----------+------+------+------------+---------+---------+---------+----------+---------+
| sid  | sname    | ssex | sage | sbirthday  | chinese | english | physics | physical | classid |
+------+----------+------+------+------------+---------+---------+---------+----------+---------+
|    1 | zhangsan | nan  |   18 | 2000-01-01 |   98.00 |   95.00 |   89.00 |    92.00 |       1 |
+------+----------+------+------+------------+---------+---------+---------+----------+---------+
1 row in set (0.00 sec)

mysql> select * from student;
+------+----------+------+------+------------+---------+---------+---------+----------+---------+
| sid  | sname    | ssex | sage | sbirthday  | chinese | english | physics | physical | classid |
+------+----------+------+------+------------+---------+---------+---------+----------+---------+
|    1 | zhangsan | nan  |   18 | 2000-01-01 |   98.00 |   95.00 |   89.00 |    92.00 |       1 |
+------+----------+------+------+------------+---------+---------+---------+----------+---------+
1 row in set (0.00 sec)

mysql> insert into student values(2,'lisi','nan',18,'2001-02-06',92,93,85,96,1);
Query OK, 1 row affected (0.00 sec)

mysql> insert into student values(3,'wangwu','nv',19,'2000-02-05',98,84,73,87,2);
Query OK, 1 row affected (0.01 sec)

mysql> insert into student values(4,'zhaoliu','nan',18,'2001-01-04',99,90,89,94,2);
Query OK, 1 row affected (0.00 sec)

mysql> insert into student values(5,'qianqi','nv',17,'2002-03-03',76,88,67,94,3);
Query OK, 1 row affected (0.00 sec)

mysql> insert into student values(6,'wangjiu','nv',17,'2002-02-02',80,75,86,62,3);
Query OK, 1 row affected (0.00 sec)

mysql> insert into student values(7,'zhengzhongtuo','nan',18,'2001-11-24',99,99,99,99,3);
ERROR 1406 (22001): Data too long for column 'sname' at row 1
mysql> select * from student;
+------+----------+------+------+------------+---------+---------+---------+----------+---------+
| sid  | sname    | ssex | sage | sbirthday  | chinese | english | physics | physical | classid |
+------+----------+------+------+------------+---------+---------+---------+----------+---------+
|    1 | zhangsan | nan  |   18 | 2000-01-01 |   98.00 |   95.00 |   89.00 |    92.00 |       1 |
|    2 | lisi     | nan  |   18 | 2001-02-06 |   92.00 |   93.00 |   85.00 |    96.00 |       1 |
|    3 | wangwu   | nv   |   19 | 2000-02-05 |   98.00 |   84.00 |   73.00 |    87.00 |       2 |
|    4 | zhaoliu  | nan  |   18 | 2001-01-04 |   99.00 |   90.00 |   89.00 |    94.00 |       2 |
|    5 | qianqi   | nv   |   17 | 2002-03-03 |   76.00 |   88.00 |   67.00 |    94.00 |       3 |
|    6 | wangjiu  | nv   |   17 | 2002-02-02 |   80.00 |   75.00 |   86.00 |    62.00 |       3 |
+------+----------+------+------+------------+---------+---------+---------+----------+---------+
6 rows in set (0.00 sec)

mysql> insert into student values(7,'zhengzhongtuo','nan',18,'2001-11-24',99,99,99,99,3);
ERROR 1406 (22001): Data too long for column 'sname' at row 1
mysql> insert into student values(7,'zzt','nan',18,'2001-11-24',99,99,99,99,3);
Query OK, 1 row affected (0.00 sec)

mysql> select * from student;
+------+----------+------+------+------------+---------+---------+---------+----------+---------+
| sid  | sname    | ssex | sage | sbirthday  | chinese | english | physics | physical | classid |
+------+----------+------+------+------------+---------+---------+---------+----------+---------+
|    1 | zhangsan | nan  |   18 | 2000-01-01 |   98.00 |   95.00 |   89.00 |    92.00 |       1 |
|    2 | lisi     | nan  |   18 | 2001-02-06 |   92.00 |   93.00 |   85.00 |    96.00 |       1 |
|    3 | wangwu   | nv   |   19 | 2000-02-05 |   98.00 |   84.00 |   73.00 |    87.00 |       2 |
|    4 | zhaoliu  | nan  |   18 | 2001-01-04 |   99.00 |   90.00 |   89.00 |    94.00 |       2 |
|    5 | qianqi   | nv   |   17 | 2002-03-03 |   76.00 |   88.00 |   67.00 |    94.00 |       3 |
|    6 | wangjiu  | nv   |   17 | 2002-02-02 |   80.00 |   75.00 |   86.00 |    62.00 |       3 |
|    7 | zzt      | nan  |   18 | 2001-11-24 |   99.00 |   99.00 |   99.00 |    99.00 |       3 |
+------+----------+------+------+------------+---------+---------+---------+----------+---------+
7 rows in set (0.00 sec)

mysql> select * from student where chinese > 95;
+------+----------+------+------+------------+---------+---------+---------+----------+---------+
| sid  | sname    | ssex | sage | sbirthday  | chinese | english | physics | physical | classid |
+------+----------+------+------+------------+---------+---------+---------+----------+---------+
|    1 | zhangsan | nan  |   18 | 2000-01-01 |   98.00 |   95.00 |   89.00 |    92.00 |       1 |
|    3 | wangwu   | nv   |   19 | 2000-02-05 |   98.00 |   84.00 |   73.00 |    87.00 |       2 |
|    4 | zhaoliu  | nan  |   18 | 2001-01-04 |   99.00 |   90.00 |   89.00 |    94.00 |       2 |
|    7 | zzt      | nan  |   18 | 2001-11-24 |   99.00 |   99.00 |   99.00 |    99.00 |       3 |
+------+----------+------+------+------------+---------+---------+---------+----------+---------+
4 rows in set (0.00 sec)

mysql> select * from student where english<=85;
+------+---------+------+------+------------+---------+---------+---------+----------+---------+
| sid  | sname   | ssex | sage | sbirthday  | chinese | english | physics | physical | classid |
+------+---------+------+------+------------+---------+---------+---------+----------+---------+
|    3 | wangwu  | nv   |   19 | 2000-02-05 |   98.00 |   84.00 |   73.00 |    87.00 |       2 |
|    6 | wangjiu | nv   |   17 | 2002-02-02 |   80.00 |   75.00 |   86.00 |    62.00 |       3 |
+------+---------+------+------+------------+---------+---------+---------+----------+---------+
2 rows in set (0.00 sec)

mysql> select * from student where physical = 99;
+------+-------+------+------+------------+---------+---------+---------+----------+---------+
| sid  | sname | ssex | sage | sbirthday  | chinese | english | physics | physical | classid |
+------+-------+------+------+------------+---------+---------+---------+----------+---------+
|    7 | zzt   | nan  |   18 | 2001-11-24 |   99.00 |   99.00 |   99.00 |    99.00 |       3 |
+------+-------+------+------+------------+---------+---------+---------+----------+---------+
1 row in set (0.00 sec)

mysql> select * from student where sage+2>20;
+------+--------+------+------+------------+---------+---------+---------+----------+---------+
| sid  | sname  | ssex | sage | sbirthday  | chinese | english | physics | physical | classid |
+------+--------+------+------+------------+---------+---------+---------+----------+---------+
|    3 | wangwu | nv   |   19 | 2000-02-05 |   98.00 |   84.00 |   73.00 |    87.00 |       2 |
+------+--------+------+------+------------+---------+---------+---------+----------+---------+
1 row in set (0.00 sec)

mysql> select * from student where chinese>=95 and english>=95;
+------+----------+------+------+------------+---------+---------+---------+----------+---------+
| sid  | sname    | ssex | sage | sbirthday  | chinese | english | physics | physical | classid |
+------+----------+------+------+------------+---------+---------+---------+----------+---------+
|    1 | zhangsan | nan  |   18 | 2000-01-01 |   98.00 |   95.00 |   89.00 |    92.00 |       1 |
|    7 | zzt      | nan  |   18 | 2001-11-24 |   99.00 |   99.00 |   99.00 |    99.00 |       3 |
+------+----------+------+------+------------+---------+---------+---------+----------+---------+
2 rows in set (0.00 sec)

mysql> select * from student where ssex = 'nan' or sage = 17;
+------+----------+------+------+------------+---------+---------+---------+----------+---------+
| sid  | sname    | ssex | sage | sbirthday  | chinese | english | physics | physical | classid |
+------+----------+------+------+------------+---------+---------+---------+----------+---------+
|    1 | zhangsan | nan  |   18 | 2000-01-01 |   98.00 |   95.00 |   89.00 |    92.00 |       1 |
|    2 | lisi     | nan  |   18 | 2001-02-06 |   92.00 |   93.00 |   85.00 |    96.00 |       1 |
|    4 | zhaoliu  | nan  |   18 | 2001-01-04 |   99.00 |   90.00 |   89.00 |    94.00 |       2 |
|    5 | qianqi   | nv   |   17 | 2002-03-03 |   76.00 |   88.00 |   67.00 |    94.00 |       3 |
|    6 | wangjiu  | nv   |   17 | 2002-02-02 |   80.00 |   75.00 |   86.00 |    62.00 |       3 |
|    7 | zzt      | nan  |   18 | 2001-11-24 |   99.00 |   99.00 |   99.00 |    99.00 |       3 |
+------+----------+------+------+------------+---------+---------+---------+----------+---------+
6 rows in set (0.00 sec)

mysql> select * from student where physics>=75 and physics<=85;
+------+-------+------+------+------------+---------+---------+---------+----------+---------+
| sid  | sname | ssex | sage | sbirthday  | chinese | english | physics | physical | classid |
+------+-------+------+------+------------+---------+---------+---------+----------+---------+
|    2 | lisi  | nan  |   18 | 2001-02-06 |   92.00 |   93.00 |   85.00 |    96.00 |       1 |
+------+-------+------+------+------------+---------+---------+---------+----------+---------+
1 row in set (0.00 sec)

mysql> select * from student where physics between 75 and 90;
+------+----------+------+------+------------+---------+---------+---------+----------+---------+
| sid  | sname    | ssex | sage | sbirthday  | chinese | english | physics | physical | classid |
+------+----------+------+------+------------+---------+---------+---------+----------+---------+
|    1 | zhangsan | nan  |   18 | 2000-01-01 |   98.00 |   95.00 |   89.00 |    92.00 |       1 |
|    2 | lisi     | nan  |   18 | 2001-02-06 |   92.00 |   93.00 |   85.00 |    96.00 |       1 |
|    4 | zhaoliu  | nan  |   18 | 2001-01-04 |   99.00 |   90.00 |   89.00 |    94.00 |       2 |
|    6 | wangjiu  | nv   |   17 | 2002-02-02 |   80.00 |   75.00 |   86.00 |    62.00 |       3 |
+------+----------+------+------+------------+---------+---------+---------+----------+---------+
4 rows in set (0.00 sec)

mysql> select * from student where physics >=75 and physics<=90;
+------+----------+------+------+------------+---------+---------+---------+----------+---------+
| sid  | sname    | ssex | sage | sbirthday  | chinese | english | physics | physical | classid |
+------+----------+------+------+------------+---------+---------+---------+----------+---------+
|    1 | zhangsan | nan  |   18 | 2000-01-01 |   98.00 |   95.00 |   89.00 |    92.00 |       1 |
|    2 | lisi     | nan  |   18 | 2001-02-06 |   92.00 |   93.00 |   85.00 |    96.00 |       1 |
|    4 | zhaoliu  | nan  |   18 | 2001-01-04 |   99.00 |   90.00 |   89.00 |    94.00 |       2 |
|    6 | wangjiu  | nv   |   17 | 2002-02-02 |   80.00 |   75.00 |   86.00 |    62.00 |       3 |
+------+----------+------+------+------------+---------+---------+---------+----------+---------+
4 rows in set (0.00 sec)

mysql> select * from student where chinese =99 or chinese=92;
+------+---------+------+------+------------+---------+---------+---------+----------+---------+
| sid  | sname   | ssex | sage | sbirthday  | chinese | english | physics | physical | classid |
+------+---------+------+------+------------+---------+---------+---------+----------+---------+
|    2 | lisi    | nan  |   18 | 2001-02-06 |   92.00 |   93.00 |   85.00 |    96.00 |       1 |
|    4 | zhaoliu | nan  |   18 | 2001-01-04 |   99.00 |   90.00 |   89.00 |    94.00 |       2 |
|    7 | zzt     | nan  |   18 | 2001-11-24 |   99.00 |   99.00 |   99.00 |    99.00 |       3 |
+------+---------+------+------+------------+---------+---------+---------+----------+---------+
3 rows in set (0.00 sec)

mysql> select * from student where chinese in (92,99);
+------+---------+------+------+------------+---------+---------+---------+----------+---------+
| sid  | sname   | ssex | sage | sbirthday  | chinese | english | physics | physical | classid |
+------+---------+------+------+------------+---------+---------+---------+----------+---------+
|    2 | lisi    | nan  |   18 | 2001-02-06 |   92.00 |   93.00 |   85.00 |    96.00 |       1 |
|    4 | zhaoliu | nan  |   18 | 2001-01-04 |   99.00 |   90.00 |   89.00 |    94.00 |       2 |
|    7 | zzt     | nan  |   18 | 2001-11-24 |   99.00 |   99.00 |   99.00 |    99.00 |       3 |
+------+---------+------+------+------------+---------+---------+---------+----------+---------+
3 rows in set (0.00 sec)

mysql> select * from student where chinese not in (92,99);
+------+----------+------+------+------------+---------+---------+---------+----------+---------+
| sid  | sname    | ssex | sage | sbirthday  | chinese | english | physics | physical | classid |
+------+----------+------+------+------------+---------+---------+---------+----------+---------+
|    1 | zhangsan | nan  |   18 | 2000-01-01 |   98.00 |   95.00 |   89.00 |    92.00 |       1 |
|    3 | wangwu   | nv   |   19 | 2000-02-05 |   98.00 |   84.00 |   73.00 |    87.00 |       2 |
|    5 | qianqi   | nv   |   17 | 2002-03-03 |   76.00 |   88.00 |   67.00 |    94.00 |       3 |
|    6 | wangjiu  | nv   |   17 | 2002-02-02 |   80.00 |   75.00 |   86.00 |    62.00 |       3 |
+------+----------+------+------+------------+---------+---------+---------+----------+---------+
4 rows in set (0.00 sec)

mysql> select * from student;
+------+----------+------+------+------------+---------+---------+---------+----------+---------+
| sid  | sname    | ssex | sage | sbirthday  | chinese | english | physics | physical | classid |
+------+----------+------+------+------------+---------+---------+---------+----------+---------+
|    1 | zhangsan | nan  |   18 | 2000-01-01 |   98.00 |   95.00 |   89.00 |    92.00 |       1 |
|    2 | lisi     | nan  |   18 | 2001-02-06 |   92.00 |   93.00 |   85.00 |    96.00 |       1 |
|    3 | wangwu   | nv   |   19 | 2000-02-05 |   98.00 |   84.00 |   73.00 |    87.00 |       2 |
|    4 | zhaoliu  | nan  |   18 | 2001-01-04 |   99.00 |   90.00 |   89.00 |    94.00 |       2 |
|    5 | qianqi   | nv   |   17 | 2002-03-03 |   76.00 |   88.00 |   67.00 |    94.00 |       3 |
|    6 | wangjiu  | nv   |   17 | 2002-02-02 |   80.00 |   75.00 |   86.00 |    62.00 |       3 |
|    7 | zzt      | nan  |   18 | 2001-11-24 |   99.00 |   99.00 |   99.00 |    99.00 |       3 |
+------+----------+------+------+------------+---------+---------+---------+----------+---------+
7 rows in set (0.00 sec)

mysql> select * from student sname like 'z%';
ERROR 1064 (42000): You have an error in your SQL syntax; check the manual that corresponds to your MySQL server version for the right syntax to use near 'like 'z%'' at line 1
mysql> select * from student sname like 'z%';
ERROR 1064 (42000): You have an error in your SQL syntax; check the manual that corresponds to your MySQL server version for the right syntax to use near 'like 'z%'' at line 1
mysql> select * from student where sname like 'z%';
+------+----------+------+------+------------+---------+---------+---------+----------+---------+
| sid  | sname    | ssex | sage | sbirthday  | chinese | english | physics | physical | classid |
+------+----------+------+------+------------+---------+---------+---------+----------+---------+
|    1 | zhangsan | nan  |   18 | 2000-01-01 |   98.00 |   95.00 |   89.00 |    92.00 |       1 |
|    4 | zhaoliu  | nan  |   18 | 2001-01-04 |   99.00 |   90.00 |   89.00 |    94.00 |       2 |
|    7 | zzt      | nan  |   18 | 2001-11-24 |   99.00 |   99.00 |   99.00 |    99.00 |       3 |
+------+----------+------+------+------------+---------+---------+---------+----------+---------+
3 rows in set (0.00 sec)

mysql> select * from student where sname like '_h%';
+------+----------+------+------+------------+---------+---------+---------+----------+---------+
| sid  | sname    | ssex | sage | sbirthday  | chinese | english | physics | physical | classid |
+------+----------+------+------+------------+---------+---------+---------+----------+---------+
|    1 | zhangsan | nan  |   18 | 2000-01-01 |   98.00 |   95.00 |   89.00 |    92.00 |       1 |
|    4 | zhaoliu  | nan  |   18 | 2001-01-04 |   99.00 |   90.00 |   89.00 |    94.00 |       2 |
+------+----------+------+------+------------+---------+---------+---------+----------+---------+
2 rows in set (0.00 sec)

mysql> select * from student where sname like '%n%';
+------+----------+------+------+------------+---------+---------+---------+----------+---------+
| sid  | sname    | ssex | sage | sbirthday  | chinese | english | physics | physical | classid |
+------+----------+------+------+------------+---------+---------+---------+----------+---------+
|    1 | zhangsan | nan  |   18 | 2000-01-01 |   98.00 |   95.00 |   89.00 |    92.00 |       1 |
|    3 | wangwu   | nv   |   19 | 2000-02-05 |   98.00 |   84.00 |   73.00 |    87.00 |       2 |
|    5 | qianqi   | nv   |   17 | 2002-03-03 |   76.00 |   88.00 |   67.00 |    94.00 |       3 |
|    6 | wangjiu  | nv   |   17 | 2002-02-02 |   80.00 |   75.00 |   86.00 |    62.00 |       3 |
+------+----------+------+------+------------+---------+---------+---------+----------+---------+
4 rows in set (0.00 sec)

mysql> select * from student where sname not like '%n%';
+------+---------+------+------+------------+---------+---------+---------+----------+---------+
| sid  | sname   | ssex | sage | sbirthday  | chinese | english | physics | physical | classid |
+------+---------+------+------+------------+---------+---------+---------+----------+---------+
|    2 | lisi    | nan  |   18 | 2001-02-06 |   92.00 |   93.00 |   85.00 |    96.00 |       1 |
|    4 | zhaoliu | nan  |   18 | 2001-01-04 |   99.00 |   90.00 |   89.00 |    94.00 |       2 |
|    7 | zzt     | nan  |   18 | 2001-11-24 |   99.00 |   99.00 |   99.00 |    99.00 |       3 |
+------+---------+------+------+------------+---------+---------+---------+----------+---------+
3 rows in set (0.00 sec)

mysql> delete from student where sname = 'wangwu';
Query OK, 1 row affected (0.00 sec)

mysql> select * from student;
+------+----------+------+------+------------+---------+---------+---------+----------+---------+
| sid  | sname    | ssex | sage | sbirthday  | chinese | english | physics | physical | classid |
+------+----------+------+------+------------+---------+---------+---------+----------+---------+
|    1 | zhangsan | nan  |   18 | 2000-01-01 |   98.00 |   95.00 |   89.00 |    92.00 |       1 |
|    2 | lisi     | nan  |   18 | 2001-02-06 |   92.00 |   93.00 |   85.00 |    96.00 |       1 |
|    4 | zhaoliu  | nan  |   18 | 2001-01-04 |   99.00 |   90.00 |   89.00 |    94.00 |       2 |
|    5 | qianqi   | nv   |   17 | 2002-03-03 |   76.00 |   88.00 |   67.00 |    94.00 |       3 |
|    6 | wangjiu  | nv   |   17 | 2002-02-02 |   80.00 |   75.00 |   86.00 |    62.00 |       3 |
|    7 | zzt      | nan  |   18 | 2001-11-24 |   99.00 |   99.00 |   99.00 |    99.00 |       3 |
+------+----------+------+------+------------+---------+---------+---------+----------+---------+
6 rows in set (0.00 sec)

mysql> update student set ssex = 'nv' where sname = 'lisi';
Query OK, 1 row affected (0.00 sec)
Rows matched: 1  Changed: 1  Warnings: 0

mysql> select * from student;
+------+----------+------+------+------------+---------+---------+---------+----------+---------+
| sid  | sname    | ssex | sage | sbirthday  | chinese | english | physics | physical | classid |
+------+----------+------+------+------------+---------+---------+---------+----------+---------+
|    1 | zhangsan | nan  |   18 | 2000-01-01 |   98.00 |   95.00 |   89.00 |    92.00 |       1 |
|    2 | lisi     | nv   |   18 | 2001-02-06 |   92.00 |   93.00 |   85.00 |    96.00 |       1 |
|    4 | zhaoliu  | nan  |   18 | 2001-01-04 |   99.00 |   90.00 |   89.00 |    94.00 |       2 |
|    5 | qianqi   | nv   |   17 | 2002-03-03 |   76.00 |   88.00 |   67.00 |    94.00 |       3 |
|    6 | wangjiu  | nv   |   17 | 2002-02-02 |   80.00 |   75.00 |   86.00 |    62.00 |       3 |
|    7 | zzt      | nan  |   18 | 2001-11-24 |   99.00 |   99.00 |   99.00 |    99.00 |       3 |
+------+----------+------+------+------------+---------+---------+---------+----------+---------+
6 rows in set (0.00 sec)

mysql> select * from student order by chinese desc;
+------+----------+------+------+------------+---------+---------+---------+----------+---------+
| sid  | sname    | ssex | sage | sbirthday  | chinese | english | physics | physical | classid |
+------+----------+------+------+------------+---------+---------+---------+----------+---------+
|    4 | zhaoliu  | nan  |   18 | 2001-01-04 |   99.00 |   90.00 |   89.00 |    94.00 |       2 |
|    7 | zzt      | nan  |   18 | 2001-11-24 |   99.00 |   99.00 |   99.00 |    99.00 |       3 |
|    1 | zhangsan | nan  |   18 | 2000-01-01 |   98.00 |   95.00 |   89.00 |    92.00 |       1 |
|    2 | lisi     | nv   |   18 | 2001-02-06 |   92.00 |   93.00 |   85.00 |    96.00 |       1 |
|    6 | wangjiu  | nv   |   17 | 2002-02-02 |   80.00 |   75.00 |   86.00 |    62.00 |       3 |
|    5 | qianqi   | nv   |   17 | 2002-03-03 |   76.00 |   88.00 |   67.00 |    94.00 |       3 |
+------+----------+------+------+------------+---------+---------+---------+----------+---------+
6 rows in set (0.00 sec)

mysql> select * from student where sage = 18 order by english asc;
+------+----------+------+------+------------+---------+---------+---------+----------+---------+
| sid  | sname    | ssex | sage | sbirthday  | chinese | english | physics | physical | classid |
+------+----------+------+------+------------+---------+---------+---------+----------+---------+
|    4 | zhaoliu  | nan  |   18 | 2001-01-04 |   99.00 |   90.00 |   89.00 |    94.00 |       2 |
|    2 | lisi     | nv   |   18 | 2001-02-06 |   92.00 |   93.00 |   85.00 |    96.00 |       1 |
|    1 | zhangsan | nan  |   18 | 2000-01-01 |   98.00 |   95.00 |   89.00 |    92.00 |       1 |
|    7 | zzt      | nan  |   18 | 2001-11-24 |   99.00 |   99.00 |   99.00 |    99.00 |       3 |
+------+----------+------+------+------------+---------+---------+---------+----------+---------+
4 rows in set (0.00 sec)

mysql> select * from student order by english;
+------+----------+------+------+------------+---------+---------+---------+----------+---------+
| sid  | sname    | ssex | sage | sbirthday  | chinese | english | physics | physical | classid |
+------+----------+------+------+------------+---------+---------+---------+----------+---------+
|    6 | wangjiu  | nv   |   17 | 2002-02-02 |   80.00 |   75.00 |   86.00 |    62.00 |       3 |
|    5 | qianqi   | nv   |   17 | 2002-03-03 |   76.00 |   88.00 |   67.00 |    94.00 |       3 |
|    4 | zhaoliu  | nan  |   18 | 2001-01-04 |   99.00 |   90.00 |   89.00 |    94.00 |       2 |
|    2 | lisi     | nv   |   18 | 2001-02-06 |   92.00 |   93.00 |   85.00 |    96.00 |       1 |
|    1 | zhangsan | nan  |   18 | 2000-01-01 |   98.00 |   95.00 |   89.00 |    92.00 |       1 |
|    7 | zzt      | nan  |   18 | 2001-11-24 |   99.00 |   99.00 |   99.00 |    99.00 |       3 |
+------+----------+------+------+------------+---------+---------+---------+----------+---------+
6 rows in set (0.00 sec)

mysql> select * from student order by sbirthday;
+------+----------+------+------+------------+---------+---------+---------+----------+---------+
| sid  | sname    | ssex | sage | sbirthday  | chinese | english | physics | physical | classid |
+------+----------+------+------+------------+---------+---------+---------+----------+---------+
|    1 | zhangsan | nan  |   18 | 2000-01-01 |   98.00 |   95.00 |   89.00 |    92.00 |       1 |
|    4 | zhaoliu  | nan  |   18 | 2001-01-04 |   99.00 |   90.00 |   89.00 |    94.00 |       2 |
|    2 | lisi     | nv   |   18 | 2001-02-06 |   92.00 |   93.00 |   85.00 |    96.00 |       1 |
|    7 | zzt      | nan  |   18 | 2001-11-24 |   99.00 |   99.00 |   99.00 |    99.00 |       3 |
|    6 | wangjiu  | nv   |   17 | 2002-02-02 |   80.00 |   75.00 |   86.00 |    62.00 |       3 |
|    5 | qianqi   | nv   |   17 | 2002-03-03 |   76.00 |   88.00 |   67.00 |    94.00 |       3 |
+------+----------+------+------+------------+---------+---------+---------+----------+---------+
6 rows in set (0.00 sec)

mysql> select * from student order by sname asc;
+------+----------+------+------+------------+---------+---------+---------+----------+---------+
| sid  | sname    | ssex | sage | sbirthday  | chinese | english | physics | physical | classid |
+------+----------+------+------+------------+---------+---------+---------+----------+---------+
|    2 | lisi     | nv   |   18 | 2001-02-06 |   92.00 |   93.00 |   85.00 |    96.00 |       1 |
|    5 | qianqi   | nv   |   17 | 2002-03-03 |   76.00 |   88.00 |   67.00 |    94.00 |       3 |
|    6 | wangjiu  | nv   |   17 | 2002-02-02 |   80.00 |   75.00 |   86.00 |    62.00 |       3 |
|    1 | zhangsan | nan  |   18 | 2000-01-01 |   98.00 |   95.00 |   89.00 |    92.00 |       1 |
|    4 | zhaoliu  | nan  |   18 | 2001-01-04 |   99.00 |   90.00 |   89.00 |    94.00 |       2 |
|    7 | zzt      | nan  |   18 | 2001-11-24 |   99.00 |   99.00 |   99.00 |    99.00 |       3 |
+------+----------+------+------+------------+---------+---------+---------+----------+---------+
6 rows in set (0.00 sec)

mysql> select * from student order by chinese desc , english desc;
+------+----------+------+------+------------+---------+---------+---------+----------+---------+
| sid  | sname    | ssex | sage | sbirthday  | chinese | english | physics | physical | classid |
+------+----------+------+------+------------+---------+---------+---------+----------+---------+
|    7 | zzt      | nan  |   18 | 2001-11-24 |   99.00 |   99.00 |   99.00 |    99.00 |       3 |
|    4 | zhaoliu  | nan  |   18 | 2001-01-04 |   99.00 |   90.00 |   89.00 |    94.00 |       2 |
|    1 | zhangsan | nan  |   18 | 2000-01-01 |   98.00 |   95.00 |   89.00 |    92.00 |       1 |
|    2 | lisi     | nv   |   18 | 2001-02-06 |   92.00 |   93.00 |   85.00 |    96.00 |       1 |
|    6 | wangjiu  | nv   |   17 | 2002-02-02 |   80.00 |   75.00 |   86.00 |    62.00 |       3 |
|    5 | qianqi   | nv   |   17 | 2002-03-03 |   76.00 |   88.00 |   67.00 |    94.00 |       3 |
+------+----------+------+------+------------+---------+---------+---------+----------+---------+
6 rows in set (0.00 sec)

mysql> select * from student order by chinese desc, english asc;
+------+----------+------+------+------------+---------+---------+---------+----------+---------+
| sid  | sname    | ssex | sage | sbirthday  | chinese | english | physics | physical | classid |
+------+----------+------+------+------------+---------+---------+---------+----------+---------+
|    4 | zhaoliu  | nan  |   18 | 2001-01-04 |   99.00 |   90.00 |   89.00 |    94.00 |       2 |
|    7 | zzt      | nan  |   18 | 2001-11-24 |   99.00 |   99.00 |   99.00 |    99.00 |       3 |
|    1 | zhangsan | nan  |   18 | 2000-01-01 |   98.00 |   95.00 |   89.00 |    92.00 |       1 |
|    2 | lisi     | nv   |   18 | 2001-02-06 |   92.00 |   93.00 |   85.00 |    96.00 |       1 |
|    6 | wangjiu  | nv   |   17 | 2002-02-02 |   80.00 |   75.00 |   86.00 |    62.00 |       3 |
|    5 | qianqi   | nv   |   17 | 2002-03-03 |   76.00 |   88.00 |   67.00 |    94.00 |       3 |
+------+----------+------+------+------------+---------+---------+---------+----------+---------+
6 rows in set (0.00 sec)

mysql> select sname,chinese+english from student;
+----------+-----------------+
| sname    | chinese+english |
+----------+-----------------+
| zhangsan |          193.00 |
| lisi     |          185.00 |
| zhaoliu  |          189.00 |
| qianqi   |          164.00 |
| wangjiu  |          155.00 |
| zzt      |          198.00 |
+----------+-----------------+
6 rows in set (0.00 sec)

mysql> select sname,chinese+english as sum from student;
+----------+--------+
| sname    | sum    |
+----------+--------+
| zhangsan | 193.00 |
| lisi     | 185.00 |
| zhaoliu  | 189.00 |
| qianqi   | 164.00 |
| wangjiu  | 155.00 |
| zzt      | 198.00 |
+----------+--------+
6 rows in set (0.00 sec)

mysql>