Enter password: ****
Welcome to the MySQL monitor.  Commands end with ; or \g.
Your MySQL connection id is 3
Server version: 5.7.25-log MySQL Community Server (GPL)

Copyright (c) 2000, 2019, Oracle and/or its affiliates. All rights reserved.

Oracle is a registered trademark of Oracle Corporation and/or its
affiliates. Other names may be trademarks of their respective
owners.

Type 'help;' or '\h' for help. Type '\c' to clear the current input statement.

mysql> show databases;
+--------------------+
| Database           |
+--------------------+
| information_schema |
| cons               |
| mysql              |
| performance_schema |
| sys                |
| test               |
+--------------------+
6 rows in set (0.00 sec)

mysql> create database newtest;
Query OK, 1 row affected (0.00 sec)

mysql> show databases;
+--------------------+
| Database           |
+--------------------+
| information_schema |
| cons               |
| mysql              |
| newtest            |
| performance_schema |
| sys                |
| test               |
+--------------------+
7 rows in set (0.00 sec)

mysql> use newtest;
Database changed
mysql> show tables;
Empty set (0.00 sec)

mysql> create table warehouse(
    ->  wname varchar(8),
    ->  winventory int(8),
    ->  wmonth varchar(8)
    -> ) character set utf8;
Query OK, 0 rows affected (0.01 sec)

mysql> insert into warehouse values
    ->  ('A',100,'一月份'),('B',1000,'一月份'),('C',10,'一月份'),
    ->  ('A',200,'二月份'),('B',2000,'二月份'),('C',20,'二月份'),
    ->  ('A',300,'三月份'),('B',3000,'三月份'),('C',30,'三月份');
Query OK, 9 rows affected (0.01 sec)
Records: 9  Duplicates: 0  Warnings: 0

mysql> select wname,winventory,wmonth from warehouse;
+-------+------------+-----------+
| wname | winventory | wmonth    |
+-------+------------+-----------+
| A     |        100 | 一月份    |
| B     |       1000 | 一月份    |
| C     |         10 | 一月份    |
| A     |        200 | 二月份    |
| B     |       2000 | 二月份    |
| C     |         20 | 二月份    |
| A     |        300 | 三月份    |
| B     |       3000 | 三月份    |
| C     |         30 | 三月份    |
+-------+------------+-----------+
9 rows in set (0.00 sec)

mysql> select
    ->  wname as 仓库名,
    ->  max(if(wmonth='一月份',winventory,0)) as 一月份,
    ->  max(if(wmonth='二月份',winventory,0)) as 二月份,
    ->  max(if(wmonth='三月份',winventory,0)) as 三月份
    -> from warehouse
    -> group by wname;
+-----------+-----------+-----------+-----------+
| 仓库名    | 一月份    | 二月份    | 三月份    |
+-----------+-----------+-----------+-----------+
| A         |       100 |       200 |       300 |
| B         |      1000 |      2000 |      3000 |
| C         |        10 |        20 |        30 |
+-----------+-----------+-----------+-----------+
3 rows in set (0.00 sec)

mysql> show databases;
+--------------------+
| Database           |
+--------------------+
| information_schema |
| cons               |
| mysql              |
| newtest            |
| performance_schema |
| sys                |
| test               |
+--------------------+
7 rows in set (0.00 sec)

mysql> use test;
Database changed
mysql> show tables;
+----------------+
| Tables_in_test |
+----------------+
| dept           |
| emp            |
| myclass        |
| newteacher     |
| person         |
| salgrade       |
| student        |
| teacher        |
| users          |
+----------------+
9 rows in set (0.00 sec)

mysql> select * from emp;
+-------+--------+-----------+------+------------+---------+---------+--------+
| empno | ename  | job       | mgr  | hiredate   | sal     | comm    | deptno |
+-------+--------+-----------+------+------------+---------+---------+--------+
|  7369 | SMITH  | CLERK     | 7902 | 1980-12-17 |  800.00 |    NULL |     20 |
|  7499 | ALLEN  | SALESMAN  | 7698 | 1981-02-20 | 1600.00 |  300.00 |     30 |
|  7521 | WARD   | SALESMAN  | 7698 | 1981-02-22 | 1250.00 |  500.00 |     30 |
|  7566 | JONES  | MANAGER   | 7839 | 1981-04-02 | 2975.00 |    NULL |     20 |
|  7654 | MARTIN | SALESMAN  | 7698 | 1981-09-28 | 1250.00 | 1400.00 |     30 |
|  7698 | BLAKE  | MANAGER   | 7839 | 1981-05-01 | 2850.00 |    NULL |     30 |
|  7782 | CLARK  | MANAGER   | 7839 | 1981-06-09 | 2450.00 |    NULL |     10 |
|  7788 | SCOTT  | ANALYST   | 7566 | 1987-04-19 | 3000.00 |    NULL |     20 |
|  7839 | KING   | PRESIDENT | NULL | 1981-11-17 | 5000.00 |    NULL |     10 |
|  7844 | TURNER | SALESMAN  | 7698 | 1981-09-08 | 1500.00 |    0.00 |     30 |
|  7876 | ADAMS  | CLERK     | 7788 | 1987-05-23 | 1100.00 |    NULL |     20 |
|  7900 | JAMES  | CLERK     | 7698 | 1981-12-03 |  950.00 |    NULL |     30 |
|  7902 | FORD   | ANALYST   | 7566 | 1981-12-03 | 3000.00 |    NULL |     20 |
|  7934 | MILLER | CLERK     | 7782 | 1982-01-23 | 1300.00 |    NULL |     10 |
|  9999 | zzt    | NULL      | NULL | NULL       |    NULL |    NULL |   NULL |
+-------+--------+-----------+------+------------+---------+---------+--------+
15 rows in set (0.00 sec)

mysql> select * from emp order by sal desc;
+-------+--------+-----------+------+------------+---------+---------+--------+
| empno | ename  | job       | mgr  | hiredate   | sal     | comm    | deptno |
+-------+--------+-----------+------+------------+---------+---------+--------+
|  7839 | KING   | PRESIDENT | NULL | 1981-11-17 | 5000.00 |    NULL |     10 |
|  7788 | SCOTT  | ANALYST   | 7566 | 1987-04-19 | 3000.00 |    NULL |     20 |
|  7902 | FORD   | ANALYST   | 7566 | 1981-12-03 | 3000.00 |    NULL |     20 |
|  7566 | JONES  | MANAGER   | 7839 | 1981-04-02 | 2975.00 |    NULL |     20 |
|  7698 | BLAKE  | MANAGER   | 7839 | 1981-05-01 | 2850.00 |    NULL |     30 |
|  7782 | CLARK  | MANAGER   | 7839 | 1981-06-09 | 2450.00 |    NULL |     10 |
|  7499 | ALLEN  | SALESMAN  | 7698 | 1981-02-20 | 1600.00 |  300.00 |     30 |
|  7844 | TURNER | SALESMAN  | 7698 | 1981-09-08 | 1500.00 |    0.00 |     30 |
|  7934 | MILLER | CLERK     | 7782 | 1982-01-23 | 1300.00 |    NULL |     10 |
|  7521 | WARD   | SALESMAN  | 7698 | 1981-02-22 | 1250.00 |  500.00 |     30 |
|  7654 | MARTIN | SALESMAN  | 7698 | 1981-09-28 | 1250.00 | 1400.00 |     30 |
|  7876 | ADAMS  | CLERK     | 7788 | 1987-05-23 | 1100.00 |    NULL |     20 |
|  7900 | JAMES  | CLERK     | 7698 | 1981-12-03 |  950.00 |    NULL |     30 |
|  7369 | SMITH  | CLERK     | 7902 | 1980-12-17 |  800.00 |    NULL |     20 |
|  9999 | zzt    | NULL      | NULL | NULL       |    NULL |    NULL |   NULL |
+-------+--------+-----------+------+------------+---------+---------+--------+
15 rows in set (0.00 sec)

mysql> delete from emp where empno = 9999;
Query OK, 1 row affected (0.00 sec)

mysql> select * from emp order by sal desc;
+-------+--------+-----------+------+------------+---------+---------+--------+
| empno | ename  | job       | mgr  | hiredate   | sal     | comm    | deptno |
+-------+--------+-----------+------+------------+---------+---------+--------+
|  7839 | KING   | PRESIDENT | NULL | 1981-11-17 | 5000.00 |    NULL |     10 |
|  7788 | SCOTT  | ANALYST   | 7566 | 1987-04-19 | 3000.00 |    NULL |     20 |
|  7902 | FORD   | ANALYST   | 7566 | 1981-12-03 | 3000.00 |    NULL |     20 |
|  7566 | JONES  | MANAGER   | 7839 | 1981-04-02 | 2975.00 |    NULL |     20 |
|  7698 | BLAKE  | MANAGER   | 7839 | 1981-05-01 | 2850.00 |    NULL |     30 |
|  7782 | CLARK  | MANAGER   | 7839 | 1981-06-09 | 2450.00 |    NULL |     10 |
|  7499 | ALLEN  | SALESMAN  | 7698 | 1981-02-20 | 1600.00 |  300.00 |     30 |
|  7844 | TURNER | SALESMAN  | 7698 | 1981-09-08 | 1500.00 |    0.00 |     30 |
|  7934 | MILLER | CLERK     | 7782 | 1982-01-23 | 1300.00 |    NULL |     10 |
|  7521 | WARD   | SALESMAN  | 7698 | 1981-02-22 | 1250.00 |  500.00 |     30 |
|  7654 | MARTIN | SALESMAN  | 7698 | 1981-09-28 | 1250.00 | 1400.00 |     30 |
|  7876 | ADAMS  | CLERK     | 7788 | 1987-05-23 | 1100.00 |    NULL |     20 |
|  7900 | JAMES  | CLERK     | 7698 | 1981-12-03 |  950.00 |    NULL |     30 |
|  7369 | SMITH  | CLERK     | 7902 | 1980-12-17 |  800.00 |    NULL |     20 |
+-------+--------+-----------+------+------------+---------+---------+--------+
14 rows in set (0.00 sec)

mysql> select * from emp order by sal desc limit 0,5;
+-------+-------+-----------+------+------------+---------+------+--------+
| empno | ename | job       | mgr  | hiredate   | sal     | comm | deptno |
+-------+-------+-----------+------+------------+---------+------+--------+
|  7839 | KING  | PRESIDENT | NULL | 1981-11-17 | 5000.00 | NULL |     10 |
|  7902 | FORD  | ANALYST   | 7566 | 1981-12-03 | 3000.00 | NULL |     20 |
|  7788 | SCOTT | ANALYST   | 7566 | 1987-04-19 | 3000.00 | NULL |     20 |
|  7566 | JONES | MANAGER   | 7839 | 1981-04-02 | 2975.00 | NULL |     20 |
|  7698 | BLAKE | MANAGER   | 7839 | 1981-05-01 | 2850.00 | NULL |     30 |
+-------+-------+-----------+------+------------+---------+------+--------+
5 rows in set (0.00 sec)

mysql> select * from emp order by sal desc limit 5,5;
+-------+--------+----------+------+------------+---------+--------+--------+
| empno | ename  | job      | mgr  | hiredate   | sal     | comm   | deptno |
+-------+--------+----------+------+------------+---------+--------+--------+
|  7782 | CLARK  | MANAGER  | 7839 | 1981-06-09 | 2450.00 |   NULL |     10 |
|  7499 | ALLEN  | SALESMAN | 7698 | 1981-02-20 | 1600.00 | 300.00 |     30 |
|  7844 | TURNER | SALESMAN | 7698 | 1981-09-08 | 1500.00 |   0.00 |     30 |
|  7934 | MILLER | CLERK    | 7782 | 1982-01-23 | 1300.00 |   NULL |     10 |
|  7521 | WARD   | SALESMAN | 7698 | 1981-02-22 | 1250.00 | 500.00 |     30 |
+-------+--------+----------+------+------------+---------+--------+--------+
5 rows in set (0.00 sec)

mysql> select * from emp order by sal desc limit 10,5;
+-------+--------+----------+------+------------+---------+---------+--------+
| empno | ename  | job      | mgr  | hiredate   | sal     | comm    | deptno |
+-------+--------+----------+------+------------+---------+---------+--------+
|  7654 | MARTIN | SALESMAN | 7698 | 1981-09-28 | 1250.00 | 1400.00 |     30 |
|  7876 | ADAMS  | CLERK    | 7788 | 1987-05-23 | 1100.00 |    NULL |     20 |
|  7900 | JAMES  | CLERK    | 7698 | 1981-12-03 |  950.00 |    NULL |     30 |
|  7369 | SMITH  | CLERK    | 7902 | 1980-12-17 |  800.00 |    NULL |     20 |
+-------+--------+----------+------+------------+---------+---------+--------+
4 rows in set (0.00 sec)

mysql>